{
  "classification_frozen_before_runs": false,
  "construction_inputs": {
    "paper_definitions_sha256": "420d6221f7c014e6c9cf83857915db4a311f90d25b97d42925259c4ebc3e6ee6",
    "review_campaign_status": "not_started",
    "source_inventory_sha256": "fb3fd3c73d3b682ef3a29f482e16e8cd4ff75097b01e35580a0d6da48fb5724b",
    "target_sha256": "d9fa68be3ede5aadb4f459337fbf77fff515264431d921c213ae139362fb7368"
  },
  "context_file": "paper_bencmark/highambench/tasks/P06/T4/context.md",
  "declarations": [
    {
      "author_label": null,
      "controlled_source_file": "paper_bencmark/highambench/shared/HighamBench/P06Definitions.lean",
      "controlled_source_line": 52,
      "declaration_id": "P06-T4-D001",
      "declaration_kind": "definition",
      "declaration_order": 1,
      "lean_name": "HighamBench.p06FiniteLoewnerLe",
      "placeholder_id": null,
      "result_form_tag": null,
      "semantic_dependency_hashes": [],
      "source_item_ids": [
        "P06-I020"
      ],
      "source_kind": "definition",
      "source_tags": [
        "TXT"
      ]
    },
    {
      "author_label": null,
      "controlled_source_file": "paper_bencmark/highambench/shared/HighamBench/P06Definitions.lean",
      "controlled_source_line": 57,
      "declaration_id": "P06-T4-D002",
      "declaration_kind": "definition",
      "declaration_order": 2,
      "lean_name": "HighamBench.p06SelfAdjointDilation",
      "placeholder_id": null,
      "result_form_tag": null,
      "semantic_dependency_hashes": [],
      "source_item_ids": [
        "P06-I022"
      ],
      "source_kind": "definition",
      "source_tags": [
        "TXT"
      ]
    },
    {
      "author_label": null,
      "controlled_source_file": "paper_bencmark/highambench/shared/HighamBench/P06Definitions.lean",
      "controlled_source_line": 105,
      "declaration_id": "P06-T4-D003",
      "declaration_kind": "definition",
      "declaration_order": 3,
      "lean_name": "HighamBench.p06Gamma",
      "placeholder_id": null,
      "result_form_tag": null,
      "semantic_dependency_hashes": [],
      "source_item_ids": [
        "P06-I004"
      ],
      "source_kind": "definition",
      "source_tags": [
        "TXT"
      ]
    },
    {
      "author_label": null,
      "controlled_source_file": "paper_bencmark/highambench/shared/HighamBench/P06Definitions.lean",
      "controlled_source_line": 109,
      "declaration_id": "P06-T4-D004",
      "declaration_kind": "definition",
      "declaration_order": 4,
      "lean_name": "HighamBench.p06ProbGamma",
      "placeholder_id": null,
      "result_form_tag": null,
      "semantic_dependency_hashes": [],
      "source_item_ids": [
        "P06-I010"
      ],
      "source_kind": "definition",
      "source_tags": [
        "TXT"
      ]
    },
    {
      "author_label": null,
      "controlled_source_file": "paper_bencmark/highambench/shared/HighamBench/P06Definitions.lean",
      "controlled_source_line": 114,
      "declaration_id": "P06-T4-D005",
      "declaration_kind": "definition",
      "declaration_order": 5,
      "lean_name": "HighamBench.p06ProductSuccessProbability",
      "placeholder_id": null,
      "result_form_tag": null,
      "semantic_dependency_hashes": [],
      "source_item_ids": [
        "P06-I010"
      ],
      "source_kind": "definition",
      "source_tags": [
        "TXT"
      ]
    },
    {
      "author_label": null,
      "controlled_source_file": "paper_bencmark/highambench/shared/HighamBench/P06Definitions.lean",
      "controlled_source_line": 172,
      "declaration_id": "P06-T4-D006",
      "declaration_kind": "definition",
      "declaration_order": 6,
      "lean_name": "HighamBench.p06WeightedQRError",
      "placeholder_id": null,
      "result_form_tag": null,
      "semantic_dependency_hashes": [],
      "source_item_ids": [
        "P06-I053"
      ],
      "source_kind": "definition",
      "source_tags": [
        "TXT"
      ]
    },
    {
      "author_label": null,
      "controlled_source_file": "paper_bencmark/highambench/shared/HighamBench/P06Definitions.lean",
      "controlled_source_line": 180,
      "declaration_id": "P06-T4-D007",
      "declaration_kind": "definition",
      "declaration_order": 7,
      "lean_name": "HighamBench.p06IsWeightedQRMinimum",
      "placeholder_id": null,
      "result_form_tag": null,
      "semantic_dependency_hashes": [],
      "source_item_ids": [
        "P06-I053"
      ],
      "source_kind": "definition",
      "source_tags": [
        "TXT"
      ]
    },
    {
      "author_label": null,
      "controlled_source_file": "paper_bencmark/highambench/shared/HighamBench/P06Definitions.lean",
      "controlled_source_line": 193,
      "declaration_id": "P06-T4-D008",
      "declaration_kind": "definition",
      "declaration_order": 8,
      "lean_name": "HighamBench.p06RoundingHistory",
      "placeholder_id": null,
      "result_form_tag": null,
      "semantic_dependency_hashes": [],
      "source_item_ids": [
        "P06-I011"
      ],
      "source_kind": "definition",
      "source_tags": [
        "TXT"
      ]
    },
    {
      "author_label": null,
      "controlled_source_file": "paper_bencmark/highambench/shared/HighamBench/P06Definitions.lean",
      "controlled_source_line": 202,
      "declaration_id": "P06-T4-D009",
      "declaration_kind": "definition",
      "declaration_order": 9,
      "lean_name": "HighamBench.p06MeanIndependent",
      "placeholder_id": null,
      "result_form_tag": null,
      "semantic_dependency_hashes": [],
      "source_item_ids": [
        "P06-I011"
      ],
      "source_kind": "definition",
      "source_tags": [
        "TXT"
      ]
    },
    {
      "author_label": null,
      "controlled_source_file": "paper_bencmark/highambench/shared/HighamBench/P06Definitions.lean",
      "controlled_source_line": 211,
      "declaration_id": "P06-T4-D010",
      "declaration_kind": "definition",
      "declaration_order": 10,
      "lean_name": "HighamBench.p06RoundingErrorModel",
      "placeholder_id": null,
      "result_form_tag": null,
      "semantic_dependency_hashes": [],
      "source_item_ids": [
        "P06-I013"
      ],
      "source_kind": "definition",
      "source_tags": [
        "TXT"
      ]
    },
    {
      "author_label": null,
      "controlled_source_file": "paper_bencmark/highambench/shared/HighamBench/P06Definitions.lean",
      "controlled_source_line": 224,
      "declaration_id": "P06-T4-D011",
      "declaration_kind": "definition",
      "declaration_order": 11,
      "lean_name": "HighamBench.p06LambdaMaxGe",
      "placeholder_id": null,
      "result_form_tag": null,
      "semantic_dependency_hashes": [],
      "source_item_ids": [
        "P06-I020"
      ],
      "source_kind": "definition",
      "source_tags": [
        "TXT"
      ]
    },
    {
      "author_label": "Lemma 2.2",
      "controlled_source_file": "paper_bencmark/highambench/shared/HighamBench/P06Definitions.lean",
      "controlled_source_line": 258,
      "declaration_id": "P06-T4-D012",
      "declaration_kind": "definition",
      "declaration_order": 12,
      "lean_name": "HighamBench.p06HouseholderConstruction",
      "placeholder_id": null,
      "result_form_tag": null,
      "semantic_dependency_hashes": [],
      "source_item_ids": [
        "P06-I018a"
      ],
      "source_kind": "named_result",
      "source_tags": [
        "LEM"
      ]
    },
    {
      "author_label": null,
      "controlled_source_file": "paper_bencmark/highambench/shared/HighamBench/P06Definitions.lean",
      "controlled_source_line": 266,
      "declaration_id": "P06-T4-D013",
      "declaration_kind": "definition",
      "declaration_order": 13,
      "lean_name": "HighamBench.p06HouseholderMatrixState",
      "placeholder_id": null,
      "result_form_tag": null,
      "semantic_dependency_hashes": [],
      "source_item_ids": [
        "P06-I003"
      ],
      "source_kind": "algorithm",
      "source_tags": [
        "TXT"
      ]
    },
    {
      "author_label": null,
      "controlled_source_file": "paper_bencmark/highambench/shared/HighamBench/P06Definitions.lean",
      "controlled_source_line": 273,
      "declaration_id": "P06-T4-D014",
      "declaration_kind": "definition",
      "declaration_order": 14,
      "lean_name": "HighamBench.p06WYUpdate",
      "placeholder_id": null,
      "result_form_tag": null,
      "semantic_dependency_hashes": [],
      "source_item_ids": [
        "P06-I043"
      ],
      "source_kind": "algorithm",
      "source_tags": [
        "TXT"
      ]
    },
    {
      "author_label": null,
      "controlled_source_file": "paper_bencmark/highambench/shared/HighamBench/P06Definitions.lean",
      "controlled_source_line": 293,
      "declaration_id": "P06-T4-D015",
      "declaration_kind": "definition",
      "declaration_order": 15,
      "lean_name": "HighamBench.p06MatrixHistory",
      "placeholder_id": null,
      "result_form_tag": null,
      "semantic_dependency_hashes": [],
      "source_item_ids": [
        "P06-I029"
      ],
      "source_kind": "definition",
      "source_tags": [
        "TXT"
      ]
    },
    {
      "author_label": null,
      "controlled_source_file": "paper_bencmark/highambench/shared/HighamBench/P06Definitions.lean",
      "controlled_source_line": 304,
      "declaration_id": "P06-T4-D016",
      "declaration_kind": "definition",
      "declaration_order": 16,
      "lean_name": "HighamBench.p06MatrixConditionalMeanZero",
      "placeholder_id": null,
      "result_form_tag": null,
      "semantic_dependency_hashes": [],
      "source_item_ids": [
        "P06-I029"
      ],
      "source_kind": "definition",
      "source_tags": [
        "TXT"
      ]
    },
    {
      "author_label": "Theorem 6.1",
      "controlled_source_file": "paper_bencmark/highambench/shared/HighamBench/P06Definitions.lean",
      "controlled_source_line": 313,
      "declaration_id": "P06-T4-D017",